{
  "event_id": "0e7d6c5b-8a0f-4b2c-9d4e-5f6a7b8c9d0e",
  "event_type": "volunteer.team.formed",
  "schema_version": 1,
  "occurred_at": "2026-07-14T06:10:00+00:00",
  "tenant_id": "9a8b7c6d-5e4f-4a3b-9c2d-1e0f9a8b7c6d",
  "producer": "volunteer-service",
  "trace_id": null,
  "data": {
    "event_id": "9b4a3f2e-5d7c-4e9f-8a1b-2c3d4e5f6a7b",
    "title": "Kelani river flooding",
    "source_district": "Gampaha",
    "team": [
      {
        "volunteer_user_id": "7c1e9a2b-4f6d-4e8a-b1c2-d3e4f5a6b7c8",
        "full_name": "Nimal Perera",
        "phone": "+94771234567",
        "skill": "boat_driver",
        "base_district": "Gampaha"
      },
      {
        "volunteer_user_id": "1f8e7d6c-9b1a-4c3d-8e5f-6a7b8c9d0e1f",
        "full_name": "Sunil Fernando",
        "phone": null,
        "skill": "first_aid",
        "base_district": "Colombo"
      }
    ]
  }
}
