{
  "event_id": "8a3f2e1d-4c6b-4d8e-9f0a-1b2c3d4e5f6a",
  "event_type": "volunteer.disaster.declared",
  "schema_version": 1,
  "occurred_at": "2026-07-14T05:00:00+00:00",
  "tenant_id": "9a8b7c6d-5e4f-4a3b-9c2d-1e0f9a8b7c6d",
  "producer": "volunteer-service",
  "trace_id": null,
  "data": {
    "event_id": "9b4a3f2e-5d7c-4e9f-8a1b-2c3d4e5f6a7b",
    "tenant_id": "9a8b7c6d-5e4f-4a3b-9c2d-1e0f9a8b7c6d",
    "title": "Kelani river flooding",
    "source_district": "Gampaha",
    "broadcast_type": "RADIUS_L1",
    "resolved_districts": ["Gampaha", "Colombo", "Kurunegala", "Kegalle", "Puttalam"],
    "requirements": [
      { "skill": "boat_driver", "required_count": 5 },
      { "skill": "first_aid", "required_count": 10 }
    ],
    "occurred_at": "2026-07-14T05:00:00+00:00"
  }
}
