{
  "event_id": "9c5b4a3f-6e8d-4f0a-9b2c-3d4e5f6a7b8c",
  "event_type": "volunteer.assignment.notified",
  "schema_version": 1,
  "occurred_at": "2026-07-14T05:00:05+00:00",
  "tenant_id": "9a8b7c6d-5e4f-4a3b-9c2d-1e0f9a8b7c6d",
  "producer": "volunteer-service",
  "trace_id": null,
  "data": {
    "event_id": "9b4a3f2e-5d7c-4e9f-8a1b-2c3d4e5f6a7b",
    "requirement_id": "0d6c5b4a-7f9e-4a1b-8c3d-4e5f6a7b8c9d",
    "volunteer_user_id": "7c1e9a2b-4f6d-4e8a-b1c2-d3e4f5a6b7c8",
    "skill": "boat_driver",
    "source_district": "Gampaha",
    "title": "Kelani river flooding"
  }
}
