{
  "event_id": "7f1e0d9c-2b4f-4a6c-9d8e-9f0a1b2c3d4e",
  "event_type": "logistics.task.assigned",
  "schema_version": 1,
  "occurred_at": "2026-07-14T13:30:00+00:00",
  "tenant_id": "9a8b7c6d-5e4f-4a3b-9c2d-1e0f9a8b7c6d",
  "producer": "logistics-service",
  "trace_id": null,
  "data": {
    "task_id": "8a2f1e0d-3c5a-4b7d-8e9f-0a1b2c3d4e5f",
    "request_id": "4b5c6d7e-8f9a-4b0c-9d1e-2f3a4b5c6d7e",
    "title": "Deliver water to Kelaniya shelter",
    "instructions": "Collect from central warehouse first",
    "priority": "high",
    "category": {
      "id": "5c6d7e8f-9a0b-4c1d-8e2f-3a4b5c6d7e8f",
      "name": "Drinking water"
    },
    "location": {
      "area": "Kelaniya",
      "lat": 6.9553,
      "lng": 79.922
    },
    "volunteer": {
      "user_id": "7c1e9a2b-4f6d-4e8a-b1c2-d3e4f5a6b7c8",
      "full_name": "Nimal Perera"
    },
    "assigned_by": {
      "user_id": "8d2f0b3c-5a7e-4f9b-8c1d-2e3f4a5b6c7d",
      "full_name": "Kamala Silva"
    },
    "assigned_at": "2026-07-14T13:30:00+00:00",
    "expires_at": null
  }
}
